term;code;description;cfr_record_id
Transparency International / Corruption Perception Index;TI/CPI;The Transparency International / Corruption Perception Index is an internationally recognized parameter for measuring corruption in a country. The Index ranks countries by their perceived levels of corruption as determined by expert assessments and opinion surveys.;2
Uncontrolled Copy;;An Uncontrolled Copy is a copy of a document whose owner will not automatically receive updates of that document. Hence, this document may not be outdated since there can be more recent versions.;3
Unforeseeable;;means not reasonably foreseeable by an experienced contractor by the Base Date.;1
United States Generally Accepted Accounting Principles;US GAAP;U.S. American accounting principle used at Siemens. It consists of numerous guidelines for individual cases and emphasizes owners' or investors' interests.;2
Validation;;Validation is the verification that the final or intermediate product fulfils the requirements defined by the customer under specified operation conditions. Its objective is to prove whether the correct product is being developed. In turnkey projects, validations are all verification activities according to customer (approved) specifications.;3
Variation;;means any change to the Employer's Requirements or the Works, which is instructed or approved as a variation under the Contract.;1
Verification;;Verification is proving that the design stage output meets the design stage input requirements. Its objective is to verify that the product is being developed correctly. In turnkey projects, verifications are without participation of or specifications by the customer and serve internal quality purposes.;3
Warranty Bond;;A part of the securities to be provided by the supplier. A Warranty Bond generally follows a →Performance Bond. Further securities are →Performance Bond, →Advance Payment Bond and →Bid Bond.;2
Work Base;;The Work Base is an area on or near the project site which is used to prepare parts of the construction and to store material, tools and equipment.;3
Work Breakdown Structure;WBS;The Work Breakdown Structure is a deliverables-oriented hierarchy (consisting of products and services). The items in the Work Breakdown Structure are expressed as nouns to underline the fact that it is a deliverable rather than an action.;3
Work Breakdown Structure;WBS;A hierarchical method that successively subdivides the work of the project into smaller detail. A WBS may be designed product-oriented, function-oriented, phase-oriented or mixed.;2
Work Package;WP;A generic term for a unit within a →Work Breakdown Structure (WBS) at the lowest level of its branch, not necessarily at the lowest level of the whole WBS. Its purpose is to bundle services for specification, tender, bid, order, execution, settlement and make them easy to manage. It may be divided into →Activities.;2
Works;;means the works and the remedying of any defects to be executed by the Contractor under the Contract.;1
day;;"means a calendar day and ""year"" means 365 days.";1
